Date Shared,Platform,Creator / Channel,URL / Media,Title / Headline,Description / Summary,Category,Tags,AI Tools Mentioned,Followers / Subscribers,Language,Notes,Publish Date,Thumbnail Url,Duration
2025-10-12,Instagram,nan,https://www.instagram.com/reel/DPf0brbDF9f/?igsh=MXJjd3JsOG1heWN1YQ==,Dpf0brbdf9f,nan,Other,"instagram, www.instagram.com",nan,Unknown,EN,nan,,,
2025-10-12,Instagram,nan,https://www.instagram.com/reel/DPdn0N3DFbj/?igsh=dXA0b3NoOG1tdzFs,Dpdn0n3dfbj,nan,Other,"instagram, www.instagram.com",nan,Unknown,EN,nan,,,
2025-10-12,Website,nan,https://joshstorylook.gumroad.com/?fbclid=PAZXh0bgNhZW0CMTEAAafaDiRmnt2ikqGssN2rgzcFP-dVLlqaP9l6Fau_-sh5xQWJgQv_OLlmgaRwbQ_aem_xTnYy1JpYBZ2qF6X3wCDVw,joshstorylook.gumroad.com,nan,AI Creative / How-To,"joshstorylook.gumroad.com, website",nan,Unknown,EN,nan,,,
2025-10-12,Instagram,nan,https://www.instagram.com/reel/DOFpKuUDMzx/?igsh=MTFtOThzc3JuOTYxZQ==,Dofpkuudmzx,nan,Other,"instagram, www.instagram.com",nan,Unknown,EN,nan,,,
2025-10-12,Instagram,nan,https://www.instagram.com/reel/DOsUY-rjLTM/?igsh=MXEybHdkempmaW5naw==,Dosuy Rjltm,nan,Other,"instagram, www.instagram.com",nan,Unknown,EN,nan,,,
2025-10-12,Instagram,nan,https://www.instagram.com/reel/DOvtZUVjKc4/?igsh=MTd3cWo1bm90Mmh0cg==,Dovtzuvjkc4,nan,Other,"instagram, www.instagram.com",nan,Unknown,EN,nan,,,
2025-10-12,Instagram,nan,https://www.instagram.com/reel/DPUO5bnDFwG/?igsh=MWt6emVpa3k1YWY4dg==,Dpuo5bndfwg,nan,Other,"instagram, www.instagram.com",nan,Unknown,EN,nan,,,
2025-10-12,Instagram,nan,https://www.instagram.com/reel/DKuPKJssccD/?igsh=MXJjOHIyenZmajlsOQ==,Dkupkjssccd,nan,Other,"instagram, www.instagram.com",nan,Unknown,EN,nan,,,
2025-10-12,Instagram,nan,https://www.instagram.com/reel/DOJNMjqDvnN/?igsh=ZTR1OGpiMmJwN2h4,Dojnmjqdvnn,nan,Other,"instagram, www.instagram.com",nan,Unknown,EN,nan,,,
2025-10-11,YouTube,https://www.youtube.com/channel/UCKBURc62w9crMI1BhzHRnvw,https://youtu.be/Uls_jXy9RuU?si=4F2mC4EQYr3tR0EX,Create CONSISTENT CHARACTERS from an INPUT IMAGE with FLUX! (ComfyUI Tutorial +  Installation Guide),"Learn the best way for creating consistent AI characters from an input image using ComfyUI.

If you like my work, please consider supporting me on Patreon: https://www.patreon.com/Mickmumpitz 
Follow me on Twitter: https://twitter.com/mickmumpitz

You can find the FREE WORKFLOWS & INSTALLATION GUIDE here: https://www.patreon.com/posts/create-from-with-115147229?utm_medium=clipboard_copy&utm_source=copyLink&utm_campaign=postshare_creator&utm_content=join_link

You can find the ADVANCED WORKFLOWS & EXAMPLE FILES here: https://www.patreon.com/posts/create-from-with-115147674

JoyCaption Alpha two: https://huggingface.co/spaces/fancyfeast/joy-caption-alpha-two
Flux GGUF Guide: https://civitai.com/articles/6730/flux-gguf

Content:
Transform single reference images into consistent character sheets using this free ComfyUI workflow! 

Learn how to generate multiple angles, expressions, and environments for your AI characters with FLUX or SDXL. Perfect for training custom character Loras, this workflow supports various art styles including Disney, Anime and Pixar-inspired looks. 

The step-by-step tutorial covers installation, prompt optimization, and advanced features for achieving character consistency in AI image generation. Essential guide for artists and creators working with stable diffusion, flux and ComfyUI.

Chapters: 
00:00 Intro
01:56 Character Sheet FLUX DEV
08:17 Style Transfer (Pixar)
10:03 Character Sheet FLUX FAST
12:08 Character Sheet SDXL
13:00 Lora Training with Flux Gym
16:23 Installation",Other,"youtu.be, youtube, yt:Uls_jXy9RuU",nan,152000,en,nan,2024-11-01,https://i.ytimg.com/vi/Uls_jXy9RuU/default.jpg,23:23
2025-10-11,YouTube,nan,https://youtube.com/playlist?list=PL-pohOSaL8P9kLZP8tQ1K1QWdZEgwiBM0&si=fWWhQQODFJ6bHCJ0,Playlist,nan,Other,"youtube, youtube.com",nan,Unknown,EN,nan,,,
2025-10-11,Instagram,nan,https://www.instagram.com/reel/DPn0DPBDCiB/?igsh=NDExdWJ2NHE3ZXp4,Dpn0dpbdcib,nan,Other,"instagram, www.instagram.com",nan,Unknown,EN,nan,,,
2025-10-11,YouTube,https://www.youtube.com/channel/UCevFnhyD9Ut5TwYdCLBh5UQ,https://youtube.com/shorts/jKiFOFFBkCU?si=SXqLKfzQtYeaiH0i,Master Context Engineering With These 3 Essential Reads #ContextEngineering #PromptEngineering #AI,"1. https://manus.im/blog/Context-Engineering-for-AI-Agents-Lessons-from-Building-Manus

2. https://blog.langchain.com/context-engineering-for-agents/

3. https://www.anthropic.com/engineering/effective-context-engineering-for-ai-agents",Other,"youtube, youtube.com, yt:jKiFOFFBkCU",nan,140000,en,nan,2025-10-10,https://i.ytimg.com/vi/jKiFOFFBkCU/default.jpg,0:47
2025-10-11,YouTube,https://www.youtube.com/channel/UCGpsgNbzdF7BECCVbB1COHw,https://youtube.com/shorts/NL6HpEobrDs?si=qdL2awQc7pDjr6LQ,NEW Sim AI DESTROYS N8N? (FREE!) 🤯,"Want to get more customers, make more profit & save 100s of hours with AI? https://go.juliangoldie.com/ai-profit-boardroom

Get a FREE AI Course + Community +1,000 AI Agents + video notes + links to the tools 👉 https://www.skool.com/ai-seo-with-julian-goldie-1553/about

🤖 Need AI Automation Services? Book a FREE AI Discovery Session Here: https://juliangoldieaiautomation.com/

🚀 Get a FREE SEO strategy Session + Discount Now: https://go.juliangoldie.com/strategy-session

🤯  Want more money, traffic and sales from SEO? Join the SEO Elite Circle👇
https://go.juliangoldie.com/register

Click below for FREE access to  ✅ 50 FREE AI SEO TOOLS 🔥 200+ AI SEO Prompts! 📈 FREE AI SEO COMMUNITY with 2,000 SEOs ! 🚀 Free AI SEO Course 🏆 Plus TODAY's Video NOTES...
https://go.juliangoldie.com/chat-gpt-prompts

FREE AI SEO Skool Group: 🚀 Want to rank #1 and make more money with SEO?
- Join here → https://www.skool.com/ai-seo-mastermind-group-3510/about

- Join our FREE AI SEO Accelerator here: https://www.facebook.com/groups/aiseomastermind",Other,"youtube, youtube.com, yt:NL6HpEobrDs",nan,288000,en,nan,2025-10-10,https://i.ytimg.com/vi/NL6HpEobrDs/default.jpg,0:28
2025-10-11,YouTube,https://www.youtube.com/channel/UCWs1D4c4vYv8PgkIiN1gLXQ,https://youtube.com/shorts/oR4gh5_NhOc?si=CfO98PqZUBQmzSLe,Scientists just figured out how to reverse aging using AI #shorts,"Scientists just figured out how to reverse aging using AI.

And this is a massive breakthrough…

We can now reprogram any human cell back to age 20.
Heart cells, brain cells, skin cells, all reset to their biological prime.
And here’s the wildest part…

The technology to do this, has already existed since 2012….it won the Nobel Prize.
But the real breakthrough wasn’t possible until this year, when they supercharged it with AI.
It’s a wild story…
So in 2006, scientists discovered Yamanaka factors.
They’re proteins that can basically convert any normal cell into a universal stem cell.
Now this was a huge deal, because these stem cells are basically like magic healers. 
If you have torn muscle tissue, you could inject these stem cells into the area and they will turn into the youthful muscle cells you need.
So Yamanaka factors were this insane breakthrough…
Because they allowed any human to turn any cell you already have into these magic healers.
But…there was one big problem…
It turns out, the original Yamanaka factors weren’t very good at this stem cell conversion.
They could do it, but they just weren’t very reliable.
Enter OpenAI.
And this is where things get crazy.
OpenAI designed a special AI model built specifically to create new proteins…
Think of it like ChatGPT but for protein engineering.
So they took all the Yamanaka research and asked this new AI to go ham on improving it.
And get this…
Their version was 50x more effective than the original.
They tested it on 50 year old cells and it successfully started repairing 30% of their cells in just 7 days.
This is just science fiction…it actually happened.
And it sounds crazy, but in a few years, humans will be able to take a shot that will literally reverse the age of their cells.
Shoutout science.",Other,"youtube, youtube.com, yt:oR4gh5_NhOc",nan,28200,en,nan,2025-10-10,https://i.ytimg.com/vi/oR4gh5_NhOc/default.jpg,1:33
2025-10-10,YouTube,https://www.youtube.com/channel/UCNuJJ38qSq8LMiltOZTgzaw,https://youtube.com/shorts/-NY2YCtH5VY?si=tt9wey3W3xykQNzA,Built Draw to Edit with Nano Banana 🤯,,Other,"youtube, youtube.com, yt:-NY2YCtH5VY",nan,56600,en,nan,2025-09-04,https://i.ytimg.com/vi/-NY2YCtH5VY/default.jpg,1:21
2025-10-10,YouTube,https://www.youtube.com/channel/UCNuJJ38qSq8LMiltOZTgzaw,https://youtube.com/shorts/OjITi3IiH50?si=AXmpPbIIZKaYVFIs,Wan Animate makes CRAZY deepfakes 🤯,,Other,"youtube, youtube.com, yt:OjITi3IiH50",nan,56600,en,nan,2025-09-20,https://i.ytimg.com/vi/OjITi3IiH50/default.jpg,0:23
2025-10-10,YouTube,https://www.youtube.com/channel/UCNuJJ38qSq8LMiltOZTgzaw,https://youtube.com/shorts/WiVbxN6wjHc?si=_z2W0Xy6cWccy1Td,FREE Runway Act-2 Alternative 🤯,,Other,"youtube, youtube.com, yt:WiVbxN6wjHc",nan,56600,en,nan,2025-09-01,https://i.ytimg.com/vi/WiVbxN6wjHc/default.jpg,0:40
2025-10-10,YouTube,https://www.youtube.com/channel/UCNuJJ38qSq8LMiltOZTgzaw,https://youtube.com/shorts/upmIhniX0mA?si=modSmZy3zHW409Yj,This is The Next Wave of AI Apps and how you could build yours 🤯,,Other,"youtube, youtube.com, yt:upmIhniX0mA",nan,56600,en,nan,2025-08-29,https://i.ytimg.com/vi/upmIhniX0mA/default.jpg,1:13
2025-10-10,TikTok,https://www.tiktok.com/@koen.ai,https://www.tiktok.com/t/ZP8AU9hRA/,This was a good one #n8n ,nan,Other,"tiktok, www.tiktok.com",nan,Unknown,EN,nan,,https://p16-sign.tiktokcdn-us.com/tos-useast5-p-0068-tx/ocuFuEBRInRSkZ7hEf8LwQDPokxbbDZfmFEgAD~tplv-tiktokx-origin.image?dr=14575&x-expires=1760961600&x-signature=au%2ByS2Ado9b8rmjq4QE2djpL0mw%3D&t=4d5b0474&ps=13740610&shp=81f88b70&shcp=43f4a2f9&idc=maliva,
2025-10-10,TikTok,https://www.tiktok.com/@ccindablock,https://www.tiktok.com/t/ZP8AU9Xao/,#sora #sora2 #meme Инвайт коды Sora 2 в лс ,nan,Other,"tiktok, www.tiktok.com",nan,Unknown,EN,nan,,https://p16-sign-sg.tiktokcdn.com/tos-alisg-p-0037/owmduKzERQNASUZf23IByZDoekkFEBigBg70D5~tplv-tiktokx-origin.image?dr=14575&x-expires=1760961600&x-signature=WXLsHKMZ9J0PVubHppMkeJF3Wl8%3D&t=4d5b0474&ps=13740610&shp=81f88b70&shcp=43f4a2f9&idc=maliva,
2025-10-10,YouTube,https://www.youtube.com/channel/UCNuJJ38qSq8LMiltOZTgzaw,https://youtube.com/shorts/llQI0gJpm20?si=sZlpcU6mnma94rar,Seedream 4 is WILD,,Other,"youtube, youtube.com, yt:llQI0gJpm20",nan,56600,en,nan,2025-09-12,https://i.ytimg.com/vi/llQI0gJpm20/default.jpg,0:52
2025-10-10,TikTok,https://www.tiktok.com/@theaisurfer,https://www.tiktok.com/t/ZP8Ay1bGD/,The Future of AI Video Has Arrived! #businessowners #entrepreneurs #businessopportunity,nan,Other,"tiktok, www.tiktok.com",nan,Unknown,EN,nan,,https://p16-sign.tiktokcdn-us.com/tos-useast5-v-85c255-tx/oIAAWgEIEDgoIh5f5CFSnBDS1cn0xwEuDCwBAf~tplv-tiktokx-origin.image?dr=14575&x-expires=1760961600&x-signature=hneCBl2oQSjeGS0KRVA%2FzAhcYIo%3D&t=4d5b0474&ps=13740610&shp=81f88b70&shcp=43f4a2f9&idc=maliva,
2025-10-10,YouTube,https://www.youtube.com/channel/UCNuJJ38qSq8LMiltOZTgzaw,https://youtube.com/shorts/z_qzVRoFKVk?si=0qu7SNeDo0AoQPAo,Sora 2 creates CRAZY CONSISTENT videos!! (here's how) 🤯🤯,,Other,"youtube, youtube.com, yt:z_qzVRoFKVk",nan,56600,en,nan,2025-10-08,https://i.ytimg.com/vi/z_qzVRoFKVk/default.jpg,1:22
2025-10-10,YouTube,https://www.youtube.com/channel/UChC_apOWk6MSl03byUiVZRQ,https://youtube.com/shorts/qLhpUQ3T7P8?si=xHy4mLq_Z69-j6vm,De-Aging Monkeys,,Other,"youtube, youtube.com, yt:qLhpUQ3T7P8",nan,1940000,en,nan,2025-10-03,https://i.ytimg.com/vi/qLhpUQ3T7P8/default.jpg,0:59
2025-10-10,Website,nan,https://theaisurfer.com/resources,Resources,nan,Other,"theaisurfer.com, website",nan,Unknown,EN,nan,,,
2025-10-10,YouTube,https://www.youtube.com/channel/UC6QCSQg29RbYk9MlcG-BL9Q,https://youtube.com/shorts/Boyf5Yo03U0?si=bkL1z5YDg0CYgQAO,OpenAI - AMD deal explained (is it a bubble),,Other,"youtube, youtube.com, yt:Boyf5Yo03U0",nan,9360,en,nan,2025-10-08,https://i.ytimg.com/vi/Boyf5Yo03U0/default.jpg,0:53
2025-10-10,YouTube,https://www.youtube.com/channel/UCWs1D4c4vYv8PgkIiN1gLXQ,https://youtube.com/shorts/XnT4BXjN35I?si=lq2E_jVmxWx9qiyH,This is the future of AI powered stores #shorts,"This is the future of AI powered stores…

What you’re seeing is a coffee shop.

But it’s not just any shop.

Because this coffee shop has AI software running 24/7 in all of their cameras.

You see those green boxes…

Each one of those is a customer.

And the AI is monitoring how long each person has been sitting in the cafe.

But here’s what’s crazy…

It’s also monitoring the workers.

You can see it’s tracking their movement with those squiggly lines and their productivity, like how many drinks each person has served per hour.

The software is called Neurospot.

And it uses AI and machine learning to live track and analyze humans in physical stores.

Now of course…as a customer, my immediate reaction is shock and fear.

It feels super weird to know you’re being tracked everywhere you go.

But as a business owner…having access to this level of real-time analytics could be super valuable.

For example…

If you ran a buffet, this software could immediately detect which areas were less popular so you could know how to rotate the menu.

Or if you ran a hardware store, you could study which aisles people linger the longest as a signal for confusion in signage and layouts.

There are endless applications for this type of data.

CCTVAI, it’d be a lot harder to steal stuff.

But the real reason this is so valuable…is because this footage will be used to train robots.

The best way for robots to learn is to watch humans complete the same task over and over.

And because of that…

I would not be shocked to see this type of AI camera software, start popping up everywhere.",Other,"youtube, youtube.com, yt:XnT4BXjN35I",nan,28200,en,nan,2025-10-08,https://i.ytimg.com/vi/XnT4BXjN35I/default.jpg,1:16
2025-10-10,YouTube,https://www.youtube.com/channel/UCybhRV3YwoYPiyub1WX9FRA,https://youtube.com/shorts/CCL9Kct3v1I?si=3A3xjdi81Iqmkamm,It’s already here 🤔 #hypercar #3dprinted #cardesign #generativedesign,"The Czinger 21C is an American-made, limited-production hybrid hypercar. It is distinguished by its use of advanced 3D printing and AI-driven design for its structure and components.
The powertrain features an in-house developed 2.88-liter twin-turbo V8 engine paired with electric motors, delivering a combined output of 1,250 to 1,350 horsepower. This setup provides a true 1:1 power-to-weight ratio.
Key performance figures include a 0-60 mph time of about 1.9 seconds and a top speed of up to 281 mph. It has a unique 1+1 tandem seating arrangement, positioning the passenger directly behind the driver. Production is limited to just 80 units, with prices starting around \$2 million.",Other,"youtube, youtube.com, yt:CCL9Kct3v1I",nan,45000,en-US,nan,2025-10-07,https://i.ytimg.com/vi/CCL9Kct3v1I/default.jpg,1:02
2025-10-10,YouTube,https://www.youtube.com/channel/UCsQoiOrh7jzKmE8NBofhTnQ,https://youtube.com/shorts/6u-snbY_CXs?si=CC0zcox_2r0JUUXS,Here are 3 Major Announcements from OpenAI DevDay,,Other,"youtube, youtube.com, yt:6u-snbY_CXs",nan,994000,en,nan,2025-10-07,https://i.ytimg.com/vi/6u-snbY_CXs/default.jpg,1:22
2025-10-10,TikTok,https://www.tiktok.com/@chase_ai_,https://www.tiktok.com/t/ZP8AUs6a1/,n8n + seedream 4.0 + Nano banana = 4K 60 FPS videos  #ai #aiagents #n8n #chatgpt ,nan,Other,"tiktok, www.tiktok.com",nan,Unknown,EN,nan,,https://p19-sign.tiktokcdn-us.com/tos-useast5-p-0068-tx/o4iuQwSRUEWLCfDsDagFjzXLQftTomEBwVU0MA~tplv-tiktokx-dmt-logom:tos-useast5-i-0068-tx/owADAXWMEDoIfCMAoDDLeExgSztREVFgA2hEXg.image?dr=14573&x-expires=1760961600&x-signature=K36pd7WCdI%2Byj01lKH5%2B3pIRj18%3D&t=4d5b0474&ps=13740610&shp=81f88b70&shcp=43f4a2f9&idc=maliva,
2025-10-10,YouTube,https://www.youtube.com/channel/UCevFnhyD9Ut5TwYdCLBh5UQ,https://youtube.com/shorts/OipEZNJ7aQg?si=uXm9mA9kEw8O-LE1,This Tool Gives You a TEAM of AI Coders. #Claude #ClaudeCode #Anthropic #Sculptor #Imbue #AI,,Other,"youtube, youtube.com, yt:OipEZNJ7aQg",nan,140000,en,nan,2025-10-09,https://i.ytimg.com/vi/OipEZNJ7aQg/default.jpg,0:40
2025-10-10,Website,nan,https://share.google/tPh5wzfUY2vdsq8eq,Tph5wzfuy2vdsq8eq,nan,Other,"share.google, website",nan,Unknown,EN,nan,,,
2025-10-10,TikTok,https://www.tiktok.com/@theaisurfer,https://www.tiktok.com/t/ZP8AUTGQs/,Unlock Next-Level Marketing Magic! #businessowners #entrepreneurs #businessopportunity,nan,Other,"tiktok, www.tiktok.com",nan,Unknown,EN,nan,,https://p16-sign.tiktokcdn-us.com/tos-useast5-v-85c255-tx/oETAOAfjIIpAAGgQfKLeJLblHGlQftIEr5Z39A~tplv-tiktokx-origin.image?dr=14575&x-expires=1760961600&x-signature=%2FAZZLC4HlWoZ2F2IilYEWTaXU9o%3D&t=4d5b0474&ps=13740610&shp=81f88b70&shcp=43f4a2f9&idc=maliva,
2025-10-10,TikTok,https://www.tiktok.com/@theaisurfer,https://www.tiktok.com/t/ZP8AyJq1K/,Kling’s AI model redefines video creativity with stunning new capabilities. #klingai #aivideo #businessowners,nan,Other,"tiktok, www.tiktok.com",nan,Unknown,EN,nan,,https://p16-sign.tiktokcdn-us.com/tos-useast5-v-85c255-tx/oMwOh4VzaPnDH4k8AAiBgDwlAz1DiPMEBAyiI~tplv-tiktokx-origin.image?dr=14575&x-expires=1760961600&x-signature=442xQ5jjqT9ro0E0bDM%2BnMWdGD8%3D&t=4d5b0474&ps=13740610&shp=81f88b70&shcp=43f4a2f9&idc=maliva,
2025-10-10,TikTok,https://www.tiktok.com/@theaisurfer,https://www.tiktok.com/t/ZP8AUGXqy/,Create Apps with Your Voice in 60 Seconds! #githubspark #businessowners #businessopportunity,nan,Other,"tiktok, www.tiktok.com",nan,Unknown,EN,nan,,https://p16-sign.tiktokcdn-us.com/tos-useast5-v-85c255-tx/ocDEYA5yiiCHvbAwIATBJNJgOg2A110ZbBJfBp~tplv-tiktokx-origin.image?dr=14575&x-expires=1760961600&x-signature=HZV9cr2j4CjNzTYF3hSesYKvaEI%3D&t=4d5b0474&ps=13740610&shp=81f88b70&shcp=43f4a2f9&idc=maliva,
2025-10-10,Website,nan,https://github.com/features/spark,Spark,nan,Other,"github.com, website",nan,Unknown,EN,nan,,,
2025-10-10,YouTube,https://www.youtube.com/channel/UCX2ANbSJse1kJnBDNw1dBSA,https://youtube.com/shorts/EOS7BzqHmw0?si=Vs25U8h1e2MF9tLo,How Sora 2 Learned Real-World Physics (The Tech Explained) #Sora2 #OpenAI #TechExplained #Veo3,,Other,"youtube, youtube.com, yt:EOS7BzqHmw0",nan,10600,en,nan,2025-10-10,https://i.ytimg.com/vi/EOS7BzqHmw0/default.jpg,1:15
2025-10-10,YouTube,https://www.youtube.com/channel/UCsQoiOrh7jzKmE8NBofhTnQ,https://youtube.com/shorts/ahSh8yJ_IPY?si=y0iW5YjZShYeyEYw,Bolt v2 Fixes the One Problem Vibe-Coders Had,,Other,"youtube, youtube.com, yt:ahSh8yJ_IPY",nan,994000,en,nan,2025-10-10,https://i.ytimg.com/vi/ahSh8yJ_IPY/default.jpg,1:10
2025-10-10,TikTok,https://www.tiktok.com/@theaisurfer,https://www.tiktok.com/t/ZP8AUGKwX/,Unlock Stunning AI Visuals with Meta Prompts! #aicreativity #businessowners #businessopportunity,nan,Other,"tiktok, www.tiktok.com",nan,Unknown,EN,nan,,https://p16-sign.tiktokcdn-us.com/tos-useast5-v-85c255-tx/oEUAsBfiJwd40GoJzIB3A6CqA2E0inYAByDCWo~tplv-tiktokx-origin.image?dr=14575&x-expires=1760961600&x-signature=MgOMgRMk2Ynm8HWaqBfiPUczziM%3D&t=4d5b0474&ps=13740610&shp=81f88b70&shcp=43f4a2f9&idc=maliva,
2025-10-10,YouTube,https://www.youtube.com/channel/UCKBURc62w9crMI1BhzHRnvw,https://youtu.be/PhiPASFYBmk?si=dZ3yxpjZm1MGaPxM,Create HYPERREALISTIC Consistent AI Characters - FREE & LOCAL! [Full ComfyUI Masterclass 2025],"Creating hyperrealistic consistent characters is now easier than ever - and it's completely FREE! 

If you like my work, please consider supporting us on Patreon: https://www.patreon.com/Mickmumpitz 
Follow me on Twitter: https://twitter.com/mickmumpitz

In this complete ComfyUI masterclass, I'll show you how to generate photorealistic AI characters with perfect consistency for AI movies, virtual influencers, or advertisements - all running locally on your computer using open-source models.

Whether you're creating stylized characters or photorealistic humans, this workflow handles it all. From dataset creation to LoRA training to final video generation - everything you need in one complete tutorial!

LINKS: 
Runpod: https://runpod.io?ref=o2xn5klc

📥 DOWNLOAD LINKS: 
🔗 Free Workflows: https://www.patreon.com/posts/new-video-create-140671046?utm_medium=clipboard_copy&utm_source=copyLink&utm_campaign=postshare_creator&utm_content=join_link
🔗 ComfyUI Installation Guide: https://mickmumpitz.ai/guides/installing-comfyui
🔗 Advanced Workflows & LoRAs: https://www.patreon.com/posts/advanced-version-140672384?utm_medium=clipboard_copy&utm_source=copyLink&utm_campaign=postshare_creator&utm_content=join_link

🎯 What You'll Learn: 

I'll walk you through my complete workflow for creating hyperrealistic consistent characters - all you need is one single input image. From there, you'll discover how to automatically generate perfect training datasets with detailed captions in one click.

You'll learn how to train your own custom character LoRAs for maximum quality and consistency, then master my ""Consistent Character Creator"" workflow that uses Qwen Image Edit to transfer poses, swap outfits with virtual try-on, and generate characters in any scene you can imagine.
Once your character is ready, I'll show you how to generate absolutely stunning hyperrealistic images using Wan 2.2, and then take it even further by creating cinematic HD and even 4k videos of your character in motion.

And because I know everyone's setup is different, I'll compare results between free open-source models and commercial options like NanoBanana and Seedream 4.0., so you can choose the approach that works best for your hardware and project needs.

⚡ Models & Tools Covered:
- Qwen Image Edit (Open Source)
- Seedream 4.0
- ComfyUI Workflows, QWEN Image Edit, Consistent Character Creator
- Flux
- Wan 2.1 & 2.2
- AI Toolkit for LoRA training
- USO Upscaling
- Runpod for cloud training
And more!

🎨 Perfect for:
AI Filmmakers, Content Creators, Virtual Influencer Projects, Advertisement & Marketing, Character Design, AI Art & Animation

⏱️ TIMESTAMPS: 
00:00 Intro
00:55 Instruction Based Image Editing
03:04 Installation
06:03 Using the Consistent Character Creator
10:15 Dataset Creation
12:16 Training a Lora
18:42 Generating images
22:05 Generating Video
23:00 Advanced Workflows


🙏 Special Thanks: Massive shoutout to our Patreon supporters who keep these workflows free and accessible for everyone! Join our community for advanced workflows, trained LoRAs, and exclusive Discord access.

Subscribe for more AI tutorials and don't forget to share your character creations - I love seeing what you come up with!",Other,"youtu.be, youtube, yt:PhiPASFYBmk",nan,152000,en,nan,2025-10-07,https://i.ytimg.com/vi/PhiPASFYBmk/default.jpg,24:23
2025-10-09,TikTok,https://www.tiktok.com/@rpn,https://www.tiktok.com/t/ZP8ASLokf/,"Perplexity's Comet browser is now available to everyone for free! You might remember that I made an organic video about it a few months ago (when it cost $200/mo to access!) and showcased the agentic capabilities of the browser. Think about what it might look like to have a personal AI assistant integrated directly into the browser you use. That's Comet. I use it all the time to ask questions about the educational YouTube videos that I watch, or to assess my performance as a creator. Comet saves time, and streamlines operations. Which if you know me, is my whole game. Everything needs to be dialed, including my browser.  #cometpartner  @Perplexity ",nan,Other,"tiktok, www.tiktok.com",nan,Unknown,EN,nan,,https://p16-pu-sign-useast8.tiktokcdn-us.com/tos-useast8-p-0068-tx2/o4QAARwI8EGAxAjhOJgAOLIIBwGeOwAfje4nMq~tplv-tiktokx-origin.image?dr=14575&x-expires=1760961600&x-signature=eUotL243LBcN6dletWBZphwKHyk%3D&t=4d5b0474&ps=13740610&shp=81f88b70&shcp=43f4a2f9&idc=maliva,
2025-10-09,Instagram,nan,https://www.instagram.com/p/DPWe35igMic/?igsh=d3QzaHAycHRmaTEx,Dpwe35igmic,nan,Other,"instagram, www.instagram.com",nan,Unknown,EN,nan,,,
2025-10-09,TikTok,https://www.tiktok.com/@filatov.designs,https://www.tiktok.com/t/ZP8ASLJYE/,"I’ve been testing Lovart and its Design Agent, and honestly, it feels like a game-changer. You can create realistic photoshoots with the exact model, location, and product. Design posters with standout graphics from scratch, and even build a full brand identity, all in one place. 💡 Why it’s useful: Normally, designers, freelancers, and small business owners spend hours switching tools, buying mockups, or hunting for stock photos. With Lovart, you just drop in your sources, write a simple prompt, and get consistent, professional results in minutes. Plus, Seedream 4.0, the AI image generation model even more powerful than Nano-Banana, is built right inside Lovart. That means faster, sharper, and more consistent results than ever. I see it as a huge time-saver for anyone who needs high-quality visuals without a full team. The results I got were 🔥 and you can try it too. #Lovart #LovartAI #CreateWithLovart #NanoBanana #AItools   ",nan,Other,"tiktok, www.tiktok.com",nan,Unknown,EN,nan,,https://p16-pu-sign-no.tiktokcdn-eu.com/tos-no1a-p-0037-no/o0aI6XUEXZIlAVBB1WiPT0i9lQCwx833YvJBN~tplv-tiktokx-origin.image?dr=14575&x-expires=1760961600&x-signature=XExqZDHPm8wsVle1LNq6iYDuBuA%3D&t=4d5b0474&ps=13740610&shp=81f88b70&shcp=43f4a2f9&idc=maliva,
2025-10-09,TikTok,https://www.tiktok.com/@draqee4,https://www.tiktok.com/t/ZP8ASLNxq/,POV: Just Stillness in Motion . . . Learn how to create the Stillness in Motion viral effect with the help of Nano Banana & Hailuoai #ContentCreators #Prompt #AIPortraits #VideoEditing #AIVideo #nanobanana,nan,Other,"tiktok, www.tiktok.com",nan,Unknown,EN,nan,,https://p16-sign-sg.tiktokcdn.com/tos-alisg-p-0037/ooAv5IAHMlBIlYlrJADzji7xoAMOCiEaAUzA7~tplv-tiktokx-origin.image?dr=14575&x-expires=1760961600&x-signature=l59oyNMsYKgiu10ExgMi%2BGyfB9w%3D&t=4d5b0474&ps=13740610&shp=81f88b70&shcp=43f4a2f9&idc=maliva,
